bion_id,Properties,property_type,property_of,Organism,value,min_value,max_value,Units,standardized_value,standardized_min,standardized_max,category,original_value,original_range
110276,Genome size data available in land plants as of 2013,Genome size data available in land plants as,2013,Plants,,,,,,,,Other,,'Table link - http://bionumbers.hms.harvard.edu/files/Genome%20size%20data%20available%20in%20land%20plants%20as%20of%202012.pdf
110349,Mean volume per cell ('000µm^3) of different cell types in plant parts of eight forage species,Mean volume per cell ('000µm^3),different cell types in plant parts of eight forage species,Plants,,,,'000µm^3,,,,Cells,,'Table link - http://bionumbers.hms.harvard.edu/files/Mean%20volume%20per%20cell%20('000%20lm%5E3)%20of%20different%20cell%20types%20in%20plant%20parts%20of%20eight%20forage%20species.pdf
110350,Mean diameter and length (µm) of cells of different types in plant parts of eight forage species,Mean diameter and length (µm),cells of different types in plant parts of eight forage species,Plants,,,,µm,,,,Cells,,'Table link - http://bionumbers.hms.harvard.edu/files/Mean%20diameter%20and%20length%20(lm)%20of%20cells%20of%20different%20types%20in%20plant%20parts%20of%20eight%20forage%20species.pdf
112371,Resting membrane potential required for K+ uptake to occur passively through a channel in roots,Resting membrane potential required for K+ uptake to occur passively through a channel in roots,,Plants,,,,mV,,,,Cell organelles,,'â¤ -230
112701,Osmotic pressure in growing cells & wall tensile stress,Osmotic pressure in growing cells & wall tensile stress,,Plants,,,,,,,,Cells,,"'osmotic pressure 2,300â6,800 mmHg (0.3â0.9MPa): wall tensile stress 75,000â375,000 mmHg (10â50MPa)"
113528,Primary cell wall composition,Primary cell wall composition,,Plants,,,,%,,,,Cells,,'a complex array of polysaccharides ~90%: some proteins ~10%
113529,Vesicle morphology in plant cells described from EM (electron microscopy) approaches,Vesicle morphology in plant cells described from EM (electron microscopy) approaches,,Plants,,,,nm,,,,Cell organelles,,'Table link - http://bionumbers.hms.harvard.edu/files/Vesicle%20morphology%20in%20plant%20cells%20described%20from%20EM%20approaches.pdf
113532,Meristem length,Meristem length,,Plants,,,,mm,,,,Other,,'root meristem ~5mm: shoot meristem ~10mm
113536,Subtropical to boreal tree leaf temperature (external temp. averages 12ËC-26ËC),Subtropical to boreal tree leaf temperature (external temp. averages 12ËC-26ËC),,Plants,21.4,,,ËC,21.4,,,DNA/RNA structures,21.4,'±2.2
113543,Average genome size,Average genome size,,Plants,,,,,,,,Other,,'angiosperms 588 Mbp: gymnosperms 15.48 Gbp
113560,Dimensions of mature sepal,Dimensions,mature sepal,Plants,,,,,,,,Other,,'length ~2mm: width 1mm: thickness <50µm
113561,Area of giant pavement cell,Area,giant pavement cell,Plants,,,,µm^2,,,,Cells,,"'<100 - â¤20,000"
114021,Change in electric potential gradient across plasma membrane during depolarization,Change in electric potential gradient across plasma membrane during depolarization,,Plants,,,,mV,,,,Cell organelles,,'from ~ -110 to -50
114026,Predominant pumps and carriers in the plasma membrane of guard cells and their functional characteristics,Predominant pumps and carriers in the plasma membrane,guard cells and their functional characteristics,Plants,,,,,,,,Cell organelles,,'Table link - http://bionumbers.hms.harvard.edu/files/Predominant%20pumps%20and%20carriers%20in%20the%20plasma%20membrane%20of%20guard%20cells%20and%20their%20functional%20characteristics.pdf
114314,The mean and range of nuclear DNA content in annual and perennial higher plant species,The mean and range,nuclear DNA content in annual and perennial higher plant species,Plants,,,,,,,,DNA/RNA structures,,'Table link - http://bionumbers.hms.harvard.edu/files/The%20mean%20and%20range%20of%20nuclear%20DNA%20content%20in%20annual%2C%20and%20perennial%20higher%20plant%20species.pdf
114315,3C nuclear DNA content of five ephemeral species,3C nuclear DNA content,five ephemeral species,Plants,,,,pg,,,,DNA/RNA structures,,'Table link - http://bionumbers.hms.harvard.edu/files/3C%20nuclear%20DNA%20content%20of%20five%20ephemeral%20species.pdf
115369,Size of bacterial aggregates in plants,Size,bacterial aggregates in plants,Plants,,,,bacterial cells,,,,Other,,"'>1,000"
102127,Genome size,Genome size,,Plasmodium falciparum,22.8,,,Mb,22.8,,,Other,22.8,
102565,Length of centimorgan,Length,centimorgan,Plasmodium falciparum,17000.0,,,bp,17000.0,,,Tissues & organs,17000,
108838,Total zinc level within infected human red blood cells,Total zinc level within infected human red blood cells,,Plasmodium falciparum,2.3,,,fg/cell,2.3,,,Cells,2.3,'±0.5
111324,Genome size,Genome size,,Poliovirus,7410.0,,,nucleotides,7410.0,,,Other,7410,
100587,Composition of cell wall,Composition,cell wall,Poplar Populus sp.,,,,,,,,Cells,,'Table link - http://bionumbers.hms.harvard.edu/files/Chemical%20composition%20of%20cell%20walls%20in%20poplar%20xylem.pdf
106468,Size of genome,Size,genome,Porcine circovirus (PCV),1.76,,,kb,1.76,,,Other,1.76,
106467,Size of capsid,Size,capsid,Porcine circovirus type 1 (PCV-1),17.0,,,nm,1.7e-08,,,Other,17,
113516,Burst size,Burst size,,Prasinovirus,,,,virions/burst,,,,Other,,'<100
109139,Parameters and variables of a cellular and molecular model of response kinetics and adaptation in primate cones and horizontal cells,Parameters and variables,a cellular and molecular model of response kinetics and adaptation in primate cones and horizontal cells,Primates,,,,,,,,Cells,,'Table link - http://bionumbers.hms.harvard.edu/files/Parameters%20and%20variables%20of%20a%20cellular%20and%20molecular%20model%20of%20response%20kinetics%20and%20adaptation%20in%20primate%20cones%20and%20horizontal%20cells.pdf
106096,Diameter of pore in carboxysome shell protein CsoS1D,Diameter,pore in carboxysome shell protein CsoS1D,Prochlorococcus,14.0,,,Å,14.0,,,Small molecules & proteins,14,
108791,Published estimates of cellular carbon content of Prochlorococcus sp.,Published estimates,cellular carbon content of Prochlorococcus sp.,Prochlorococcus,,,,µm,,,,Cells,,'Table link - http://bionumbers.hms.harvard.edu/files/Published%20estimates%20of%20cellular%20carbon%20content%20of%20Prochlorococcus%20sp..pdf
109017,Diameter of largest virus-like particles found in the food vacuole of Phaeodarian radiolarians,Diameter,largest virus-like particles found in the food vacuole of Phaeodarian radiolarians,Protist Phaeodarian radiolarians,,,,nm,,,,Cell organelles,,'â¤750
107971,Volume of dinoflagellate species analyzed,Volume,dinoflagellate species analyzed,Protists,,180.0,279.0,Î¼m^3,,1.8000000000000002e-16,2.79e-16,Other,,"'180 to 279,000 Table link - http://bionumbers.hms.harvard.edu/files/Linear%20dimensions%20and%20volume%2C%20C%20and%20N%20quota%2C%20density%20%2C%20and%20C-N%20ratios%20of%20dinoflagellate%20species%20analyzed%20in%20this%20study.pdf"
107955,Cellular attributes and heat production for eight marine phototrophic protists,Cellular attributes and heat production for eight marine phototrophic protists,,Protists,,,,,,,,Cells,,'Table link - http://bionumbers.hms.harvard.edu/files/Cellular%20attributes%20and%20heat%20production%20for%20eight%20marine%20phototrophic%20protists.pdf
107957,Slope of log carbon versus log volume for 8 protists,Slope,log carbon versus log volume for 8 protists,Protists,0.67,0.6,0.73,,,,,Other,0.67,'0.60 to 0.73
107958,Slope of log cellular heat production versus log surface area,Slope,log cellular heat production versus log surface area,Protists,1.057,,,log(pW/cell)/log(Î¼m^2),1.057,,,Cells,1.057,'±0.12
115628,Diameter of bacteria which B. saltans can ingest,Diameter,bacteria which B. saltans can ingest,Protozoa Bodo saltans,,,,µm,,,,Other,,'<3
115654,Length of bacterial cells Cyclidium spp. have difficulty feeding on,Length,bacterial cells Cyclidium spp. have difficulty feeding on,Protozoa Cyclidium spp.,,4.0,5.0,µm,,4e-06,4.9999999999999996e-06,Cells,,'>4 - 5
117077,Dimensions of pear-shaped trophozoite,Dimensions,pear-shaped trophozoite,Protozoa Giardia lamblia,,12.0,15.0,µm,,1.2e-05,1.4999999999999999e-05,Other,,'length 12-15µm: width 5-9µm
100278,Genome Size,Genome Size,,Pufferfish Fugu rubripes,400000000.0,,,Base pairs,400000000.0,,,Other,400000000,
111375,Protein-coding genes,Protein-coding genes,,Pufferfish Fugu rubripes,19231.0,,,genes,19231.0,,,Small molecules & proteins,19231,
106100,Some physical properties of the virions of the 30 families of RNA viruses,Some physical properties,the virions of the 30 families of RNA viruses,RNA viruses,,,,,,,,DNA/RNA structures,,'Table link - http://bit.ly/hmwLW5
100999,Kcat of Phosphofructokinase in muscle tissue,Kcat,Phosphofructokinase in muscle tissue,Rabbit,61200.0,,,1/min,61200.0,,,Tissues & organs,61200,
108249,Mobility of proteins in the cytoplasm of cultured muscle cells,Mobility,proteins in the cytoplasm of cultured muscle cells,Rabbit,,,,,,,,Small molecules & proteins,,'Table link - http://bionumbers.hms.harvard.edu/files/Mobility%20of%20proteins%20in%20the%20cytoplasm%20of%20cultured%20muscle%20cells.pdf
109444,Chondrocyte volume per unit cartilage volume,Chondrocyte volume per unit cartilage volume,,Rabbit,,,,,,,,Other,,'Table link - http://bionumbers.hms.harvard.edu/files/Chondrocyte%20volume%20per%20unit%20cartilage%20volume.pdf
116929,Volume of alveolar macrophage (AM) in normal rat,Volume,alveolar macrophage (AM) in normal rat,Rat Rattus norvegicus,1170.0,400.0,5000.0,µm^3,1.17e-15,4.0000000000000004e-16,5e-15,Other,1170,'400 - 5000
107662,Size of cup-shaped porosomes on astrocytes,Size,cup-shaped porosomes on astrocytes,Rat Rattus norvegicus,,10.0,15.0,nm,,1e-08,1.5000000000000002e-08,Other,,'10 to 15
107021,Size of tubular segments of cristae in the rat-liver mitochondria,Size,tubular segments of cristae in the rat-liver mitochondria,Rat Rattus norvegicus,,30.0,40.0,nm,,3.0000000000000004e-08,4e-08,Cell organelles,,'30 to 40nm in diameter: up to several hundred nm long
107573,Diameter of large and small dense-core vesicles,Diameter,large and small dense-core vesicles,Rat Rattus norvegicus,,90.0,120.0,nm,,9.000000000000001e-08,1.2000000000000002e-07,Cell organelles,,'90 to 120 large dense-core vesicles: ~80 small dense-core vesicles
107663,Diameter of membrane-bound secretory vesicles that dock at porosome,Diameter,membrane-bound secretory vesicles that dock at porosome,Rat Rattus norvegicus,,0.2,1.2,Î¼m,,2e-07,1.2e-06,Cell organelles,,'0.2 to 1.2
108931,Size of PC12 pheochromocytoma cell,Size,PC12 pheochromocytoma cell,Rat Rattus norvegicus,,9.0,13.0,Î¼m,,9e-06,1.3e-05,Cells,,'9 to 13 Table link - http://bionumbers.hms.harvard.edu/files/Sizes%20of%20various%20cells.pdf
108936,Size of neural stem cell,Size,neural stem cell,Rat Rattus norvegicus,,11.0,13.0,Î¼m,,1.1e-05,1.3e-05,Cells,,'11 to 13 Table link - http://bionumbers.hms.harvard.edu/files/Sizes%20of%20various%20cells.pdf
108906,Diameter of PC-12 adrenal gland cell,Diameter,PC-12 adrenal gland cell,Rat Rattus norvegicus,,12.0,14.0,Î¼m,,1.2e-05,1.4e-05,Cells,,'12 to 14
109244,Fixed membrane capacitance,Fixed membrane capacitance,,Rat Rattus norvegicus,,0.88,0.9,Î¼F/cm^2,,0.88,0.9,Cell organelles,,'0.88 to 0.9
112318,Î² cell turnover in young,Î² cell turnover in young,,Rat Rattus norvegicus,,1.0,3.0,months,,1.0,3.0,Cells,,'1 - 3
112477,"Following Ca2+ stress, opening of mitochondrial permeability transition pore (mPTP) occurs within","Following Ca2+ stress, opening",mitochondrial permeability transition pore (mPTP) occurs within,Rat Rattus norvegicus,,5.0,10.0,sec,,5.0,10.0,Cell organelles,,'5 - 10
110393,Protein-Nitrogen to Total-Protein conversion factor,Protein-Nitrogen to Total-Protein conversion factor,,Rat Rattus norvegicus,5.77,5.72,5.82,grams of total-protein/grams of protein-nitrogen,5.77,5.72,5.82,Small molecules & proteins,5.77,'5.72 to 5.82
100928,mitochondria volume share in the cell,mitochondria volume share in the cell,,Rat Rattus norvegicus,,8.0,38.0,%,,8.0,38.0,Cell organelles,,'8-38
109228,Lifespan of average Î²-cell,Lifespan,average Î²-cell,Rat Rattus norvegicus,,20.0,50.0,Days,,20.0,50.0,Cells,,'20 to 50
115800,Length of disordered regions in many metal-binding proteins,Length,disordered regions in many metal-binding proteins,Rat Rattus norvegicus,,30.0,50.0,residues (amino acids),,30.0,50.0,Small molecules & proteins,,'~30-50
107275,Mitochondrial proton electrochemical potential across the inner membrane in isolated rat liver,Mitochondrial proton electrochemical potential across the inner membrane in isolated rat liver,,Rat Rattus norvegicus,,200.0,220.0,mV,,200.0,220.0,Cell organelles,,'200 to 220
102197,Developmental stages including approximate age and size,Developmental stages including approximate age and size,,Rat Rattus norvegicus,,,,,,,,Other,,'Table link - http://bionumbers.hms.harvard.edu/files/28developmentalstagesIIrat.pdf
102382,Percent of integral membrane proteins out of secretory pathway proteins,Percent,integral membrane proteins out of secretory pathway proteins,Rat Rattus norvegicus,28.0,,,%,28.0,,,Small molecules & proteins,28,
102617,Percent of selenium in plasma accounted for by selenoprotein P,Percent,selenium in plasma accounted for by selenoprotein P,Rat Rattus norvegicus,60.0,,,%,60.0,,,Small molecules & proteins,60,
102728,Percent of vesicles labelled by VGLUT1 [Vesicular glutamate transporter 1] antibodies,Percent,vesicles labelled by VGLUT1 [Vesicular glutamate transporter 1] antibodies,Rat Rattus norvegicus,,,,%,,,,Cell organelles,,'66.8
102731,Amount of protein in synaptic vesicle,Amount,protein in synaptic vesicle,Rat Rattus norvegicus,1.71,,,g/vesicle,1.71,,,Small molecules & proteins,1.71E-17,'±0.19
102732,Amount of phospholipids in synaptic vesicle,Amount,phospholipids in synaptic vesicle,Rat Rattus norvegicus,8.8,,,g/vesicle,8.8,,,Cell organelles,8.8E-18,
102733,Amount of cholesterol in synaptic vesicle [SV],Amount,cholesterol in synaptic vesicle [SV],Rat Rattus norvegicus,3.7,,,g/vesicle,3.7,,,Cell organelles,3.7E-18,
102775,Diameter of a synaptic vesicle,Diameter,a synaptic vesicle,Rat Rattus norvegicus,41.6,,,nm,4.16e-08,,,Cell organelles,41.6,'±8.4
102776,Inner aqueous volume of a synaptic vesicle,Inner aqueous volume,a synaptic vesicle,Rat Rattus norvegicus,2.0,,,µm^3,2e-18,,,Cell organelles,2E-05,
102781,Area on lipid bilayer occupied by phospholipid molecule,Area on lipid bilayer occupied by phospholipid molecule,,Rat Rattus norvegicus,65.0,,,Å^2,65.0,,,Small molecules & proteins,65,
102784,Length of fully assembled core complex of R-SNARE,Length,fully assembled core complex of R-SNARE,Rat Rattus norvegicus,12.0,,,nm,1.2000000000000002e-08,,,Other,12,
102928,Red blood cell diameter,Red blood cell diameter,,Rat Rattus norvegicus,6.5,,,µm,6.5e-06,,,Cells,6.5,
103199,Cerebellum proportion out of central nervous system (by volume),Cerebellum proportion out,central nervous system (by volume),Rat Rattus norvegicus,10.0,,,%,10.0,,,Other,10,
103200,Spinal cord proportion out of central nervous system (by volume),Spinal cord proportion out,central nervous system (by volume),Rat Rattus norvegicus,35.0,,,Percent,35.0,,,Other,35,
103201,Cerebral cortex proportion out of central nervous system (by volume),Cerebral cortex proportion out,central nervous system (by volume),Rat Rattus norvegicus,31.0,,,%,31.0,,,Other,31,
103353,Quantitative measurements of synaptic vesicle [SV] Proteins and Lipids,Quantitative measurements,synaptic vesicle [SV] Proteins and Lipids,Rat Rattus norvegicus,,,,,,,,Small molecules & proteins,,'Table link - http://bionumbers.hms.harvard.edu/files/Quantitative%20measurements%20of%20synaptic%20vesicle%20Proteins%20and%20Lipids.pdf
103621,Pindolol binding to beta adrenoreceptor in ventricular heart tissue,Pindolol binding to beta adrenoreceptor in ventricular heart tissue,,Rat Rattus norvegicus,19.8,,,femtomol/mg protein,19.8,,,Tissues & organs,19.8,'±0.5
103956,Alveolar type I cell volume,Alveolar type I cell volume,,Rat Rattus norvegicus,716.0,,,µm^3,7.160000000000001e-16,,,Cells,716,'±84
103957,Alveolar macrophage diameter,Alveolar macrophage diameter,,Rat Rattus norvegicus,14.1,,,µm,1.4099999999999999e-05,,,Other,14.1,'±0.4
103958,Alveolar type I cell diameter,Alveolar type I cell diameter,,Rat Rattus norvegicus,11.1,,,µm,1.1099999999999999e-05,,,Cells,11.1,'±0.7
103961,Water content of alveolar type I cell,Water content,alveolar type I cell,Rat Rattus norvegicus,69.8,,,%,69.8,,,Cells,69.8,
103964,Water content of various rat tissues,Water content,various rat tissues,Rat Rattus norvegicus,,,,,,,,Tissues & organs,,'Table link - http://bionumbers.hms.harvard.edu/files/WATER%20CONTENT%20OF%20VARIOUS%20RAT%20TISSUES.pdf
104258,Nucleo-cytoplasmic flux of dextrans in cultured rat liver cells,Nucleo-cytoplasmic flux,dextrans in cultured rat liver cells,Rat Rattus norvegicus,,,,,,,,Cell organelles,,'Table link - http://bionumbers.hms.harvard.edu/files/Nucleo-cytoplasmic%20flux%20of%20dextrans%20in%20cultured%20rat%20liver%20cells.pdf
104261,Diameter of hepatocyte nucleus,Diameter,hepatocyte nucleus,Rat Rattus norvegicus,8.0,,,µm,8e-06,,,Nuclei,8,
104616,Volume of hepatocyte,Volume,hepatocyte,Rat Rattus norvegicus,,,,Î¼m^3,,,,Other,,"'~7,000"
105705,"Length, width and volume of cardiac myocytes","Length, width and volume",cardiac myocytes,Rat Rattus norvegicus,,,,,,,,Other,,'table link - http://bionumbers.hms.harvard.edu/files/Length%2C%20width%20and%20volume%20of%20rat%20cardiac%20myocytes.pdf
106149,Mitochondrial and cytosolic water content in liver cell,Mitochondrial and cytosolic water content in liver cell,,Rat Rattus norvegicus,,,,Î¼l/mg of compartmental protein,,,,Cell organelles,,'0.8 mitochondrial water 3.8 cytosolic water
106150,Subcellular pH and electrical potential difference in perfused livers,Subcellular pH and electrical potential difference in perfused livers,,Rat Rattus norvegicus,,,,,,,,Cells,,'Table link - http://bionumbers.hms.harvard.edu/files/Subcellular%20pH%20and%20electrical%20potential%20difference%20in%20perfused%20livers.pdf
106151,Mitochondrial membrane potential in perfused liver,Mitochondrial membrane potential in perfused liver,,Rat Rattus norvegicus,118.0,,,mV,118.0,,,Cell organelles,118,'±10 Table link - http://bionumbers.hms.harvard.edu/files/Subcellular%20pH%20and%20electrical%20potential%20difference%20in%20perfused%20livers.pdf
107081,Mean Î² cell lifespan,Mean Î² cell lifespan,,Rat Rattus norvegicus,,,,Months,,,,Cells,,'~6
107136,Volume of mitochondrion,Volume,mitochondrion,Rat Rattus norvegicus,0.27,,,Î¼m^3,2.7000000000000006e-19,,,Other,0.27,'Table link - http://bionumbers.hms.harvard.edu/files/Structural%20and%20Functional%20Characteristics%20of%20the%20average%20isolated%20mitochondrion.pdf
107186,Cellular Mg content of ventricular muscle,Cellular Mg content,ventricular muscle,Rat Rattus norvegicus,43.4,,,mmoles/kg dry weight,43.4,,,Cells,43.4,'±0.4
107187,Cellular Mg content of skeletal muscle,Cellular Mg content,skeletal muscle,Rat Rattus norvegicus,16.1,,,mM,0.016100000000000003,,,Cells,16.1,
107219,Mean life-span of Î²-cell in 10 month old rat,Mean life-span,Î²-cell in 10 month old rat,Rat Rattus norvegicus,,,,Months,,,,Cells,,'~6
107307,Protein content of mesangial cell,Protein content,mesangial cell,Rat Rattus norvegicus,93.4,,,Î¼g/10^6 cells,93.4,,,Small molecules & proteins,93.4,'±6.5
107308,Volume of mesangial cell,Volume,mesangial cell,Rat Rattus norvegicus,3137.4,,,fL,3137.4,,,Cells,3137.4,'±62.1
107336,Properties of some glycolytic branches in tumor cells,Properties,some glycolytic branches in tumor cells,Rat Rattus norvegicus,,,,,,,,Cells,,'Table link - http://bionumbers.hms.harvard.edu/files/Properties%20of%20some%20glycolytic%20branches%20in%20tumor%20cells.pdf
107423,Chain lengths of fatty acids in rat liver membranes,Chain lengths,fatty acids in rat liver membranes,Rat Rattus norvegicus,,,,,,,,Cell organelles,,'Table link - http://bionumbers.hms.harvard.edu/files/Chain%20lengths%20of%20fatty%20acids%20in%20rat%20liver%20membranes.jpg
107669,"Adipocyte volume, insulin binding, internalization and degradation and insulin receptor down-regulation in adipocytes","Adipocyte volume, insulin binding, internalization and degradation and insulin receptor down-regulation in adipocytes",,Rat Rattus norvegicus,,,,,,,,DNA/RNA structures,,'Table link - http://bionumbers.hms.harvard.edu/files/ADIPOCYTE%20VOLUME%2C%20INSULIN%20BINDING%2C%20INTERNALIZATION%20AND%20DEGRADATION%20AND%20INSULIN%20RECEPTOR%20DOWN-REGULATION%20IN%20ADIPOCYTES.pdf
107876,Determination of adipose cell size in eight epididymal fat pads by four methods,Determination,adipose cell size in eight epididymal fat pads by four methods,Rat Rattus norvegicus,,,,Î¼g of lipid/cell,,,,Cells,,'Table link - http://bionumbers.hms.harvard.edu/files/Determination%20of%20adipose%20cell%20size%20in%20eight%20epididymal%20fat%20pads%20by%20four%20methods.pdf
108102,Electrical potential difference across plasma membrane (âÏe) in hepatocyte,Electrical potential difference across plasma membrane (âÏe) in hepatocyte,,Rat Rattus norvegicus,,,,mV,,,,Cell organelles,,'-30
108125,Electrical potential differences across the inner mitochondrial membrane,Electrical potential differences across the inner mitochondrial membrane,,Rat Rattus norvegicus,,,,mV,,,,Cell organelles,,'-155
108243,Volume of cardiomyocyte,Volume,cardiomyocyte,Rat Rattus norvegicus,,,,Î¼m^3,,,,Other,,'15.6±0.5Ñ10^3
108886,Diameter of fetal neuronal stem cell from brain,Diameter,fetal neuronal stem cell from brain,Rat Rattus norvegicus,11.0,,,Î¼m,1.1e-05,,,Cells,11,
108933,Size of whole blood cell,Size,whole blood cell,Rat Rattus norvegicus,4.6,,,Î¼m,4.599999999999999e-06,,,Cells,4.6,'Table link - http://bionumbers.hms.harvard.edu/files/Sizes%20of%20various%20cells.pdf
108993,Protein content in liver mitochondrial matrix,Protein content in liver mitochondrial matrix,,Rat Rattus norvegicus,47.3,,,%,47.3,,,Small molecules & proteins,47.3,
109191,Diameter of synaptic vesicle,Diameter,synaptic vesicle,Rat Rattus norvegicus,30.0,,,nm,3.0000000000000004e-08,,,Cell organelles,30,
109227,Volume of Î²-cell,Volume,Î²-cell,Rat Rattus norvegicus,1020.0,,,Î¼m^3,1.02e-15,,,Cells,1020,
109436,Areas of mitochondrial envelope and endoplasmic reticulum membrane in liver,Areas,mitochondrial envelope and endoplasmic reticulum membrane in liver,Rat Rattus norvegicus,,,,,,,,Cell organelles,,'Table link - http://bionumbers.hms.harvard.edu/files/Areas%20of%20mitochondrial%20envelope%20and%20endoplasmic%20reticulum%20membrane.pdf
109438,Intramitochondrial structure in liver,Intramitochondrial structure in liver,,Rat Rattus norvegicus,,,,,,,,Cell organelles,,'Table link - http://bionumbers.hms.harvard.edu/files/Intramitochondrial%20structure.pdf
109440,Ultrastructural composition of rat liver parenchymal cells calculated per average cell (nucleus),Ultrastructural composition,rat liver parenchymal cells calculated per average cell (nucleus),Rat Rattus norvegicus,,,,,,,,Nuclei,,'Table link - http://bionumbers.hms.harvard.edu/files/Ultrastructural%20composition%20of%20rat%20liver%20parenchymal%20cells%20calculated%20per%20average%20cell%20(nucleus).pdf
110126,Size of megakaryocyte,Size,megakaryocyte,Rat Rattus norvegicus,,,,,,,,Other,,'Table link - http://bionumbers.hms.harvard.edu/files/Megakaryocytic%20Size.pdf
110617,Permeability of red blood cell membrane to CO2,Permeability,red blood cell membrane to CO2,Rat Rattus norvegicus,0.0075,,,cm/sec,0.0075,,,Cell organelles,0.0075,
110714,Reversal potential (Erev) of endoplasmic reticulum in pancreatic cell,Reversal potential (Erev),endoplasmic reticulum in pancreatic cell,Rat Rattus norvegicus,,,,mV,,,,Cell organelles,,'-31
111086,Volume of typical presynaptic varicosity,Volume,typical presynaptic varicosity,Rat Rattus norvegicus,,,,fL,,,,Other,,'~1
111274,Mean diameter of islet of Langerhans,Mean diameter,islet of Langerhans,Rat Rattus norvegicus,200.0,,,Î¼m,0.00019999999999999998,,,Other,200,
111275,Mean diameter of beta cell of islet of Langerhans,Mean diameter,beta cell of islet of Langerhans,Rat Rattus norvegicus,10.0,,,Î¼m,9.999999999999999e-06,,,Cells,10,
111348,Reported or derived data on the lymphocyte content of different lymphoid organs and tissues in normal young adult,Reported or derived data on the lymphocyte content,different lymphoid organs and tissues in normal young adult,Rat Rattus norvegicus,,,,absolute number×10^9/kg body weight,,,,Tissues & organs,,'Table link - http://bionumbers.hms.harvard.edu/files/Reported%20or%20derived%20data%20on%20the%20lymphocyte%20content%20of%20different%20lymphoid%20organs%20and%20tissues%20in%20normal%20young%20adult.pdf
111356,Contents of adenine nucleotides in liver tissue,Contents,adenine nucleotides in liver tissue,Rat Rattus norvegicus,,,,,,,,DNA/RNA structures,,'Table link - http://bionumbers.hms.harvard.edu/files/Contents%20of%20adenine%20nucleotides%20in%20liver%20tissue.pdf
111427,Life span of taste bud cell in tongue,Life span,taste bud cell in tongue,Rat Rattus norvegicus,250.0,,,hours,250.0,,,Cells,250,'±50
111660,Summed length of dendrites of a hippocampal pyramidal neuron,Summed length,dendrites of a hippocampal pyramidal neuron,Rat Rattus norvegicus,,,,µm,,,,Other,,"'~20,000"
111663,Hippocampal CA1 spine dimensions and correlations with synaptic (PSD) area,Hippocampal CA1 spine dimensions and correlations with synaptic (PSD) area,,Rat Rattus norvegicus,,,,,,,,Other,,'Table link - http://bionumbers.hms.harvard.edu/files/Hippocampal%20CA1%20spine%20dimensions%20and%20correlations%20with%20synaptic%20(PSD)%20area.pdf
